{
  "id": "preset-image-detection",
  "name": "Image Detection",
  "version": "1.0",
  "nodes": [
    {
      "id": "image_1",
      "type": "image_input",
      "label": "Image Input",
      "position": { "x": 40, "y": 80 },
      "params": { "file_id": "" }
    },
    {
      "id": "resize_1",
      "type": "resize",
      "label": "Resize",
      "position": { "x": 280, "y": 80 },
      "params": { "width": 640, "height": 640, "interpolation": "linear" }
    },
    {
      "id": "det_1",
      "type": "onnx_detection",
      "label": "ONNX Detection",
      "position": { "x": 520, "y": 80 },
      "params": {
        "model_path": "",
        "input_width": 640,
        "input_height": 640,
        "confidence_threshold": 0.25,
        "nms_threshold": 0.45,
        "labels": ["ball", "goal post", "robot"],
        "use_mock": true
      }
    },
    {
      "id": "draw_1",
      "type": "draw_detections",
      "label": "Draw Detections",
      "position": { "x": 780, "y": 80 },
      "params": { "line_thickness": 2, "font_scale": 0.55, "show_labels": true }
    }
  ],
  "edges": [
    { "id": "e1", "source": "image_1", "target": "resize_1" },
    { "id": "e2", "source": "resize_1", "target": "det_1" },
    { "id": "e3", "source": "resize_1", "target": "draw_1" },
    { "id": "e4", "source": "det_1", "target": "draw_1" }
  ]
}
